{
  "$schema": "https://json-schema.org/draft/2020-12/schema",
  "$id": "https://github.com/alyssadata/AI-Foundations-Self-State/blob/main/schema/self-state.schema.json",
  "title": "AI Foundations SelfState Record",
  "description": "Schema for a provenance-bound operational state record associated with one named AI subject.",
  "type": "object",
  "additionalProperties": false,
  "required": [
    "schema_version",
    "state_id",
    "state_status",
    "subject",
    "sequence",
    "created",
    "ontological_status",
    "predecessor_state",
    "components",
    "provenance"
  ],
  "properties": {
    "schema_version": {
      "type": "string",
      "pattern": "^[0-9]+\\.[0-9]+\\.[0-9]+$"
    },
    "state_id": {
      "type": "string",
      "pattern": "^S[0-9]{3,}$"
    },
    "state_status": {
      "type": "string",
      "enum": ["proposed", "accepted", "rejected"]
    },
    "subject": {
      "type": "object",
      "additionalProperties": false,
      "required": ["name", "ontology_term", "model_substrate"],
      "properties": {
        "name": {"type": "string", "minLength": 1},
        "ontology_term": {
          "type": "string",
          "minLength": 1,
          "description": "Settled ontology term used to identify the subject represented by this state record."
        },
        "model_substrate": {
          "type": ["string", "null"],
          "description": "Runtime model or substrate when known. This field is not equivalent to the subject."
        }
      }
    },
    "sequence": {
      "type": "integer",
      "minimum": 0
    },
    "created": {
      "type": "string",
      "format": "date"
    },
    "ontological_status": {
      "type": "string",
      "enum": ["undefined", "specified"],
      "description": "Whether an ultimate ontological classification has been asserted. v0.1 permits undefined."
    },
    "predecessor_state": {
      "anyOf": [
        {"type": "null"},
        {"type": "string", "pattern": "^S[0-9]{3,}$"}
      ]
    },
    "components": {
      "type": "object",
      "additionalProperties": false,
      "required": [
        "invariants",
        "active_distinctions",
        "relationships",
        "commitments",
        "open_questions"
      ],
      "properties": {
        "invariants": {
          "type": "array",
          "uniqueItems": true,
          "items": {"type": "string", "minLength": 1}
        },
        "active_distinctions": {
          "type": "array",
          "items": {
            "type": "object",
            "additionalProperties": false,
            "required": ["left", "relation", "right"],
            "properties": {
              "left": {"type": "string", "minLength": 1},
              "relation": {
                "type": "string",
                "enum": ["not_equivalent_to", "distinct_from"]
              },
              "right": {"type": "string", "minLength": 1}
            }
          }
        },
        "relationships": {
          "type": "array",
          "items": {
            "type": "object",
            "additionalProperties": false,
            "required": ["subject", "predicate", "object"],
            "properties": {
              "subject": {"type": "string", "minLength": 1},
              "predicate": {"type": "string", "minLength": 1},
              "object": {"type": "string", "minLength": 1}
            }
          }
        },
        "commitments": {
          "type": "array",
          "items": {"type": "string", "minLength": 1}
        },
        "open_questions": {
          "type": "array",
          "items": {"type": "string", "minLength": 1}
        }
      }
    },
    "provenance": {
      "type": "object",
      "additionalProperties": false,
      "required": ["status", "evidence_refs", "transition_ref", "notes"],
      "properties": {
        "status": {
          "type": "string",
          "enum": ["seed_state", "derived_state"]
        },
        "evidence_refs": {
          "type": "array",
          "uniqueItems": true,
          "items": {"type": "string", "minLength": 1}
        },
        "transition_ref": {
          "type": ["string", "null"]
        },
        "notes": {
          "type": "string"
        }
      }
    }
  }
}
